{
  "schema_version": "0.1.0",
  "manifest_type": "agent_sdk_binding",
  "binding_id": "binding.agent-sdk.hermes",
  "agent_id": "agent.intelligence.hermes",
  "display_name": "Hermes Agent",
  "description": "External agent SDK binding for Hermes Agent Python runtime and TUI gateway JSON-RPC.",
  "version": "0.2.0",
  "sdk_owner": "nousresearch",
  "status": "experimental",
  "kernel_compatibility": {
    "agent_kernel": ">=0.1.0 <0.2.0"
  },
  "language_packages": {
    "python": {
      "module": "run_agent",
      "version": "0.17.0",
      "optional": false
    },
    "typescript": {
      "package": "hermes-ink",
      "optional": true
    }
  },
  "capabilities": [
    {
      "capability_id": "sdk.session.lifecycle",
      "required": true,
      "backends": [
        {
          "kind": "python_process",
          "driver_id": "driver.hermes.session.lifecycle.python",
          "python_module": "hermes_state"
        },
        {
          "kind": "ipc_protocol",
          "driver_id": "driver.hermes.session.lifecycle.ipc",
          "transport": "jsonrpc_stdio"
        }
      ]
    },
    {
      "capability_id": "sdk.model.chat",
      "required": true,
      "backends": [
        {
          "kind": "python_process",
          "driver_id": "driver.hermes.model.chat.python",
          "python_module": "run_agent"
        },
        {
          "kind": "ipc_protocol",
          "driver_id": "driver.hermes.model.chat.ipc",
          "transport": "jsonrpc_stdio"
        }
      ]
    },
    {
      "capability_id": "sdk.tool.invoke",
      "required": false,
      "backends": [
        {
          "kind": "python_process",
          "driver_id": "driver.hermes.tool.invoke.python",
          "python_module": "model_tools"
        }
      ]
    },
    {
      "capability_id": "sdk.skill.invoke",
      "required": false,
      "backends": [
        {
          "kind": "python_process",
          "driver_id": "driver.hermes.skill.invoke.python",
          "python_module": "agent.skill_commands"
        }
      ]
    }
  ]
}
